IA.Name,Member.ID,Start.Date,End.Date,IA.ID,IA.Group.1,IA.Group.2,Type,City,Voivodship,Full.Name,Age,Gender,RT.Affiliation,Profession
PAN Department of Legal Sciences,140,1954-07-01,1956-06-30,IA00998,PAN,DOLS,Research Institue,NA,NA,Jan Olszewski,58,M,Opposition,Lawyer
Warsaw University Department of Math Computer Science and Mechanics,141,1962-01-01,1975-12-31,IA01324,UW,DMCSM,Postsecondary School,NA,NA,Janusz Onyszkiewicz,51,M,Opposition,Academic Mathematician
Silesia University Faculty of Law and Administration in Katowice,142,1974-09-01,1989-02-01,IA01170,SILU,FLAA,NA,NA,NA,Walerian Pańko,47,M,Opposition,Academic Law
Central Statistical Office,143,1960-01-01,1962-12-31,IA00306,GUS,NA,Government Leadership Body National,NA,NA,Aleksander Paszyński,60,M,Opposition,Journalist
Warsaw University Faculty of Law and Administration Institute of Administrative Law Department of Administrative and Banking Law,144,1978-09-01,1989-02-01,IA01338,UW,FLAAIALD,Postsecondary School,NA,NA,Krystyna Pawłowicz,36,F,Opposition,Academic Law
Factory Committee Solidarność KWK Manifest Lipcowy,145,1980-09-01,1981-12-31,IA00406,FCKWKM,NA,Protest Action,NA,NA,Alojzy Pietrzyk,37,M,Opposition,Worker Miner
Press Union of Poles in Germany,146,1934-01-01,1939-09-01,IA01094,PUPIG,NA,International Professional Association,NA,NA,Edmund Jan Osmańczych,75,M,Opposition,Journalist
NSZZ Solidarność Member,147,1980-09-01,1989-02-01,IA00873,NSZZS,MEMB,Opposition Group,NA,NA,Janusz Pałubicki,41,M,Opposition,Academic Art History
Fisheries Enterprise and Fishing Services KOGA in Hel,149,1960-01-01,1961-06-30,IA00445,FEFSK,NA,Factory,NA,NA,Zygmunt Polański,59,M,Opposition,Academic Economics
District Thermal Energy Enterprise in Bytom,150,1975-09-01,1978-06-30,IA00383,DTEEB,NA,Factory,NA,NA,Piotr Polmański,34,M,Opposition,Worker Miner
Provincial House of Culture Bydgoszcz,151,1962-09-01,1967-08-31,IA01107,PHCB,NA,Government Agency Regional or Local,NA,NA,Jerzy Puciata,55,M,Opposition,Artist
PZPR member,152,1978-01-01,1980-12-31,IA01113,PZPR,MEM,NA,NA,NA,Edward Radziewicz,41,M,Opposition,Worker Mechanic
Institute of Pedagogical Research,153,1977-09-01,1988-12-31,IA00535,IPR,NA,Research Institue,NA,NA,Julian Radziewicz,51,M,Opposition,Academic Pedagogy
Jan Zamoyski High School Warsaw,154,1982-09-01,1989-02-01,IA00608,JZHS,NA,High School,NA,NA,Anna Radziwiłł,52,F,Opposition,Academic Historian
City Hospital Gliwice,155,1964-01-01,1978-06-30,IA00320,CHG,NA,Medical Facility,NA,NA,Krzysztof Rajpert,55,M,Opposition,Medical Doctor
Łódź University Department of Urban Economic Planning,156,1974-09-01,1989-02-01,IA00687,LU,DUEP,Postsecondary School,NA,NA,Jerzy Regulski,64,M,Opposition,Academic Economist
“Słowo Powszechny”,158,1950-01-01,1953-12-31,IA00134,SLPO,NA,Periodical,NA,NA,Ryszard Reiff,65,M,Opposition,Journalist
Factory Committee Solidarność Mining and Steelworks Plant “Bolesław” in Bukowny,159,1980-09-01,1981-12-31,IA00411,FCMSPB,NA,Protest Action,NA,NA,Czesław Robakowski,40,M,Opposition,Worker Miner
Fire Fighter Szczecin,160,1970-01-01,1975-12-31,IA00441,FFS,NA,Factory,NA,NA,Zbigniew Rokicki,41,M,Opposition,Worker Farmer
Papal Academy of Theology Kraków,161,1985-09-01,1986-08-31,IA00975,PACTK,NA,Postsecondary School,NA,NA,Jan Rokita,29,M,Opposition,Lawyer
Letter in Support of Adam Michnik,162,1968-05-01,1968-05-30,IA00659,LSAM,NA,NA,NA,NA,Zbigniew Romaszewski,49,M,Opposition,Academic Physics
International Labor Union Geneva,163,1930-07-01,1939-09-01,IA00587,ILO,GEN,International Professional Association,NA,NA,Jan Rosner,83,M,Opposition,Academic Economics
Jagiellonian University Faculty of Law,164,1945-09-01,1949-08-31,IA00597,UJ,FOL,Postsecondary School,NA,NA,Andrzej Rozmarynowicz,65,M,Opposition,Lawyer
PAN Institute of History,165,1953-01-01,1989-02-01,IA01007,PAN,IH,Research Institue,NA,NA,Henryk Rutkowski,59,M,Opposition,Academic Historian
Gdynia Sea Fisheries Institute,167,1969-07-01,1989-02-01,IA00485,GSFI,NA,Research Institue,Gdynia,NA,Jerzy Salmonowicz,63,M,Opposition,Academic Chemist
Warsaw University Institute of History,168,1967-01-01,1978-12-31,IA01350,UW,IOH,Postsecondary School,NA,NA,Henryk Samsonowicz,59,M,Opposition,Academic Historian
Nysa Factory for Research Support,169,1979-09-01,1989-02-01,IA00962,NYSA,NA,Factory,NA,NA,Janusz Sanocki,34,M,Opposition,Worker
National Section of Engineers and Water Managers,170,1980-01-01,1981-12-31,IA00784,NSEWM,NA,National Professional Association,NA,NA,Adolf Sapkowski,62,M,Opposition,Worker Engineer
Teachers Solidarność Gdańsk,171,1988-09-01,1989-02-01,IA01243,TSOLIGK,NA,Opposition Group Leadership Body Regional or Local,NA,NA,Jarosław Sellin,25,M,Opposition,Academic
Institute of Immunology and Experimental Therapy Wrocław,172,1968-01-01,1969-12-31,IA00531,IIETW,NA,Research Institue,NA,NA,Władysław Sidorowicz,54,M,Opposition,Medical Doctor
Warsaw Voivodship Court Judge,174,1975-07-01,1987-06-30,IA01291,WVCJ,NA,Legal Office,NA,NA,Jadwiga Skórzewska,46,F,Opposition,Lawyer
Łódź Defenders of Peace Industrial Cotton Factory,175,1951-01-01,1954-12-31,IA00679,LDPIC,NA,Factory,NA,NA,Magdalena Sokołowska,66,F,Opposition,Academic
NZS University Committee Gdańsk University,176,1986-01-01,1988-12-31,IA00954,NZS,UCGU,Opposition Group Leadership Body Regional or Local,NA,NA,Andrzej Sosnowski,25,M,Opposition,Student
Bielsko-Biały High School for Workers,177,1972-09-01,1977-08-31,IA00262,BBHSW,NA,High School,Bielska-Biala,NA,Grażyna Staniszewska,39,F,Opposition,Academic
Network of Leading Plant Works,178,1981-01-01,1981-12-13,IA00786,NLPW,NA,Government Leadership Body National,NA,NA,Tomasz Stankiewicz,42,M,Opposition,Academic
Bolesław High School for Adults Sopot,179,1945-09-01,1946-08-31,IA00267,BHSA,NA,High School,Sopot,NA,Adam Stanowski,61,M,Opposition,Academic
Warsaw High School No. 20,180,1958-09-01,1959-08-31,IA01293,WHS20,NA,High School,NA,NA,Krystyna Starczewska,51,F,Opposition,Academic
KSS-KOR Intervention Committee,181,1978-09-01,1978-09-30,IA00627,KSSKOR,IC,Opposition Group Leadership Body National,NA,NA,Stefan Starczewski,53,M,Opposition,Academic
PAN Copernicus Astronomical Center,183,1976-09-01,1989-02-01,IA00995,PAN,CAC,Research Institue,NA,NA,Antoni Stawikowski,55,M,Opposition,Academic
Adam Mickiewicz University Faculty of Biology Department of General Zoology,184,1966-01-01,1989-02-01,IA00190,AMU,FBGZ,Postsecondary School,Poznan,NA,Kazimierz Stępczak,52,M,Opposition,Academic
Iskra Bearing Factory Center for Research and Development,185,1979-07-01,1983-03-30,IA00592,IBFCRD,NA,Research Institue,NA,NA,Jerzy Stępien,42,M,Opposition,Lawyer
Association of Catholic Youth “Revival”,187,1932-09-01,1939-09-01,IA00235,ACYR,NA,Independent Society,NA,NA,Stanisław Stomma,81,M,Opposition,Academic
Social Insurance Institution (ZUS) Headquarters Warsaw,188,1953-09-01,1956-12-31,IA01183,ZUS,HQ,Government Agency National,NA,NA,Adam Strzembosz,58,M,Opposition,Lawyer
PAN Institute of Physics,189,1979-09-01,1985-08-31,IA01015,PAN,IPHYSICS,Research Institue,NA,NA,Andrzej Suchocki,35,M,Opposition,Academic
Warsaw Uprising,190,1944-08-01,1944-11-30,IA01368,POWWAW,NA,Protest Action,NA,NA,Klemens Szaniawski,63,M,Opposition,Academic
Medical Academy Kraków,191,1972-01-01,1989-02-01,IA00719,MEDAK,NA,Postsecondary School,NA,NA,Andrzej Szczeklik,50,M,Opposition,Medical Doctor
Jagiellonian University Faculty of Indo-Iranian Philology,192,1945-09-01,1947-08-31,IA00596,UJ,FIIP,Postsecondary School,NA,NA,Jan Józef Szczepański,70,M,Opposition,Journalist
“Express Wieczorny”,193,1975-01-01,1980-12-31,IA00030,EXW,NA,Periodical,NA,NA,Jarosław Józef Szczepański,38,M,Opposition,Academic
Factory Committee Solidarność Lenin Shipyards Gdańsk,194,1981-09-01,1981-12-13,IA00407,FCLSG,NA,Protest Action,NA,NA,Edward Szwajkiewicz,34,M,Opposition,Worker Electrician
PAN Institute of History,195,1974-07-01,1989-02-01,IA01007,PAN,IH,Research Institue,NA,NA,Jacek Szymanderski,43,M,Opposition,Academic
Federation of Fighting Youth National Coordinating Committee,196,1988-01-01,1989-02-01,IA00437,FFY,NCC,Opposition Group Leadership Body National,NA,NA,Piotr Szynkiel,21,M,Opposition,Worker
Commission for the Realization of the Rzeszow-Ustrycki Agreement,198,1985-01-01,1989-02-01,IA00335,CRRUA,NA,Opposition Group,NA,NA,Józef ślisz,54,M,Opposition,Worker Farmer
Wrocław Technical College for Finances,199,1952-09-01,1953-08-31,IA01386,WRTCF,NA,Postsecondary School,NA,NA,Hanna świlda-Ziemba,58,F,Opposition,Academic
NSZZ Solidarność Member,200,1980-09-01,1989-02-01,IA00873,NSZZS,MEMB,Opposition Group,NA,NA,Henryk Tachasiuk,26,M,Opposition,Worker
Coastal Free Trade Unions,201,1978-01-01,1980-08-01,IA00325,CFTU,NA,Opposition Group,NA,NA,Jacek Taylor,49,M,Opposition,Lawyer
Bicycle Factory Premot Romet Bydgoszcz,202,1975-07-01,1989-02-01,IA00261,BFPR,NA,Factory,Bydgoszcz,NA,Antoni Tokarczuk,37,M,Opposition,Academic
PAN Institute of Economics,204,1982-01-01,1989-02-01,IA01002,PAN,IEC,Research Institue,NA,NA,Andrzej Topiński,43,M,Opposition,Academic
Central School of Trade Warsaw,205,1947-09-01,1951-08-31,IA00303,SGH,NA,Postsecondary School,NA,NA,Witold Trzeciakowski,62,M,Opposition,Academic
Medical Academy Gdańsk,207,1959-10-01,1985-12-31,IA00713,MEDAG,NA,Postsecondary School,NA,NA,Jerzy Umiastowski,56,M,Opposition,Medical Doctor
Small Vehicle Factory Bielsko-Biały Department of Transport,208,1977-07-01,1989-02-01,IA01171,SVFBB,DOT,Factory,NA,NA,Henryk Urban,37,M,Opposition,Worker
Lenin Shipyards Gdańsk,209,1967-07-01,1976-06-30,IA00649,LSYG,NA,Factory,NA,NA,Lech Wałęsa,45,M,Opposition,Worker
Warsaw University Faculty of Law and Administration,210,1939-07-01,1948-06-30,IA01336,UW,FLAA,Postsecondary School,NA,NA,Zofia Wasikowska,78,F,Opposition,Lawyer
PAN Institute of Philosophy and Sociology,211,1972-09-01,1979-08-31,IA01014,PAN,IPS,Research Institue,NA,NA,Jerzy Wertenstein-Żuławski,41,M,Opposition,Academic
Mining Works Łęczna,212,1978-07-01,1983-03-30,IA00744,MWL,NA,NA,NA,NA,Stanisław Węglarz,40,M,Opposition,Worker Miner
NSZZ Solidarność Founding Committee Warsaw Television Works,213,1980-09-01,1981-12-13,IA00842,NSZZS,FCWTW,Opposition Group Leadership Body Regional or Local,NA,NA,Andrzej Wieczorek,40,M,Opposition,Journalist
Association of Rural Youth,214,1945-05-01,1948-06-30,IA00247,ZMW,NA,Independent Society,NA,NA,Andrzej Wielowieyski,61,M,Opposition,Lawyer
Paris École pratique des hautes études,215,1955-09-01,1956-12-31,IA01025,PEPHE,NA,Postsecondary School,NA,NA,Zbigniew Wierzbicki,69,M,Opposition,Academic
Warsaw University Faculty of Geology,216,1966-09-01,1970-08-31,IA01332,UW,FGEOL,Postsecondary School,NA,NA,Michał Wilczyński,40,M,Opposition,Academic
Polish Sociological Association,217,1966-09-01,1989-02-01,IA01070,PSOCA,NA,National Professional Association,NA,NA,Edmund Wnuk-Lipiński,44,M,Opposition,Academic
Wolski Hospital Warsaw,218,1970-07-01,1975-06-30,IA01375,WHW,NA,Medical Facility,NA,NA,Ewa Wolak,55,F,Opposition,Medical Doctor
Medical Academy Poznań Regional Liaison Committee with Scientists,219,1980-09-01,1980-12-13,IA00726,MEDAP,RLCS,Postsecondary School,NA,NA,Zbigniew Woźniak,41,M,Opposition,Medical Doctor
“Znak”,220,1957-01-01,1959-06-30,IA00177,ZNAK,NA,Periodical,NA,NA,Jacek Woźniakowski,68,M,Opposition,Academic
Ministry of Finance Institute of Finance,221,1977-01-01,1980-12-31,IA00755,MINF,IF,Government Leadership Body National,NA,NA,Irena Wóycicka,38,F,Opposition,Journalist
Polish Scouting Association - ZHP,222,1973-01-01,1989-02-01,IA01068,ZHP,NA,NA,NA,NA,Wojciech Wróblewski,31,M,Opposition,Academic
KIK Warsaw,223,1962-09-01,1989-02-01,IA00624,KIK,WAW,Salon,NA,NA,Henryk Wujec,48,M,Opposition,Worker
Self-educating Group,224,1988-01-01,1989-02-01,IA01157,SEG,NA,Independent Society,NA,NA,Jan Jakub Wygnański,24,M,Opposition,Academic
“Mies. Instrukcyjny ZMP”,226,1948-01-01,1956-06-30,IA00079,MIZMP,NA,NA,NA,NA,Jan Zalewski,58,M,Opposition,Journalist
NSZZ Solidarność Member,227,1980-10-01,1989-02-01,IA00873,NSZZS,MEMB,Opposition Group,NA,NA,Zbigniew Zawistowski,44,M,Opposition,Architect
Higher School of Pedagogy Katowice,228,1961-01-01,1963-12-31,IA00507,HSPKA,NA,Postsecondary School,Katowice,NA,Jerzy Zdrada,52,M,Opposition,Academic
Institute of Synthetic and Artificial Fibers Gorzów Wielkopolska,229,1956-09-01,1957-12-31,IA00541,ISAFG,NA,Research Institue,NA,NA,Andrzej Ziabicki,55,M,Opposition,Academic
Jagiellonian University Faculty of Law,230,1982-09-01,1989-02-01,IA00597,UJ,FOL,Postsecondary School,NA,NA,Tadeusz Zieliński,62,M,Opposition,Lawyer
Adam Mickiewicz University,231,1957-01-01,1989-02-01,IA00189,AMU,NA,Postsecondary School,Poznan,NA,Janusz Ziółkowski,64,M,Opposition,Academic
Commission for the Realization of the Rzeszow-Ustrycki Agreement,5,1981-02-09,1981-12-13,IA00335,CRRUA,NA,Opposition Group,NA,NA,Artur Balasz,37,M,Opposition,Agricultural Engineer
NSZZ Solidarność Advisor,6,1980-08-31,1989-02-01,IA00802,NSZZS,AD,Opposition Group Leadership Body National,NA,NA,Bolesław Banaszkiewich,34,M,Opposition,Lawyer
Interned Goleniów,7,1981-12-13,1982-02-12,IA00549,INT,GOLE,Protest Action,NA,NA,Piotr Baumgart,47,M,Opposition,Agricultural Worker Technician
Warsaw Uprising,8,1944-08-01,1944-10-02,IA01368,POWWAW,NA,Protest Action,NA,NA,Janusz Beksiak,59,M,Opposition,Academic Economics
Inter-factory Coordinating Committee for Solidarność Youth,13,1982-01-01,1984-12-31,IA00553,MKSSY,NA,Protest Action,NA,NA,Grzegorz Bierecki,25,M,Opposition,Academic Humanities
Catholic Youth Academic Association “Soli Deo”,14,1987-10-01,1989-02-01,IA00283,CYASD,NA,Charitable or Humanitarian Organization,NA,NA,Robert Bitner,22,M,Opposition,Academic Student
Warsaw University Department of Biophysics,15,1985-01-01,1989-02-01,IA01321,UW,DBIOP,Postsecondary School,NA,NA,Grzegorz Boguta,36,M,Opposition,Academic Biophysics
Association of Polish Youth,19,1949-01-01,1956-12-31,IA00245,ZMP,NA,Independent Society,NA,NA,Stefan Bratkowski,54,M,Opposition,Journalist
Institute for Building,22,1970-01-01,1973-12-31,IA00523,IB,NA,Research Institue,NA,NA,Ryszard Bugaj,44,M,Opposition,Academic Economist
Inter-factory Founding Committee Mazowsze,23,1980-09-04,1981-12-13,IA00574,MKZMA,NA,Protest Action,NA,NA,Zbigniew Bujak,33,M,Opposition,Worker Electrician
NSZZ Solidarność Founding Committee Ministry of Justice,24,1980-08-31,1980-10-01,IA00843,NSZZS,FCMINJUS,NA,NA,NA,Iwo Byczewski,40,M,Opposition,Academic Law
March 1968 Student Protests Warsaw,25,1968-03-01,1968-06-01,IA00703,MR68,WAW,Protest Action,NA,NA,Andrzej Czeliński,38,M,Opposition,Academic Sociology
PAN Medical Sciences Commission,26,1976-01-01,1989-02-01,IA01020,PAN,MEDSC,Research Institue,NA,NA,Zbigniew Chłap,59,M,Opposition,Medical Doctor
NSZZ Solidarność Founding Committee Medical Academy Poznań,27,1980-09-01,1981-12-31,IA00837,NSZZS,FCMEDAP,Opposition Group Leadership Body Regional or Local,NA,NA,Maria Chmiel,59,F,Opposition,Medical Doctor
“Biuletynu” KOS,28,1982-05-01,1989-02-01,IA00008,BKOS,NA,NA,NA,NA,Eryk Chojnacki,26,M,Opposition,Academic Student
NZS University Committee Warsaw University,30,1989-01-01,1989-02-01,IA00959,NZS,UCUW,NA,NA,NA,Piotr Ciompa,21,M,Opposition,Academic Student
Miners Solidarność National Committee advisor,31,1980-09-01,1981-12-13,IA00740,MNRSO,NCA,Opposition Group Leadership Body National,NA,NA,Paweł Czartoryski,64,M,Opposition,Academic Economics and History of Science
Polish Scouting Association - ZHP,32,1978-01-01,1982-12-31,IA01068,ZHP,NA,NA,NA,NA,Piotr Czerwiec,25,M,Opposition,Academic Student
Factory Committee Solidarność Radom,34,1980-09-01,1981-12-13,IA00417,FCR,NA,Protest Action,NA,NA,Piotr Dąbrowski,38,M,Opposition,Engineer Agriculture
First Solidarność National Congress Delegate,35,1981-10-01,1981-11-30,IA00444,FSNCD,NA,Opposition Group Meeting,NA,NA,Tadeusz Diem,48,M,Opposition,Academic Chemistry
Higher School of Economics Poznań,36,1961-09-01,1968-08-31,IA00502,HSEP,NA,Postsecondary School,Poznan,NA,Jerzy Dietl,61,M,Opposition,Academic Economics
Higher School of Economics Sopot Faculty of the Sea,38,1950-09-01,1951-08-31,IA00504,HSES,FOTS,Postsecondary School,Sopot,NA,Wladysław Dobrowolski,61,M,Opposition,Academic Economics
Lech Wałęsa advisor,39,1980-09-01,1989-02-01,IA00648,LWAD,NA,Opposition Group Leadership Body National,NA,NA,Andrzej Dobrucki,65,M,Opposition,Lawyer
Polish Scouting Association Central School for Instructors,41,1979-01-01,1981-12-31,IA01069,ZHP,CSI,Scouting Organization,NA,NA,Michał Downarowicz,33,M,Opposition,Academic
Wrocław University Faculty of Math Physics and Chemistry,42,1980-09-01,1985-12-31,IA01391,WRPOLY,FMPHYSC,Postsecondary School,NA,NA,Roman Duda,53,M,Opposition,Academic Mathematics
KSS-KOR Collaborator,43,1977-09-01,1977-12-31,IA00626,KSSKOR,NA,Opposition Group,NA,NA,Jan Dworak,40,M,Opposition,Journalist
Pirogow Hospital,45,1972-09-01,1989-02-01,IA01041,PH,NA,Medical Facility,NA,NA,Marek Edelman,66,M,Opposition,Medical Doctor
Social Legislative Council (Solidarność),46,1980-09-01,1989-02-01,IA01184,SLCS,NA,Opposition Group Leadership Body National,NA,NA,Lech Falandysz,46,M,Opposition,Lawyer
“Gazeta Handlowa”,47,1949-01-01,1956-12-13,IA00038,GHAND,NA,Periodical,NA,NA,Wanda Falkowska-Szymańska,65,F,Opposition,Journalist
“Sztandar Młodych”,48,1955-01-01,1957-12-31,IA00148,SZML,NA,Periodical,NA,NA,Dariusz Fikus,56,M,Opposition,Journalist
PAN,49,1986-01-01,1989-02-01,IA00976,PAN,NA,Research Institue,NA,NA,Władysław Findeisen,63,M,Opposition,Academic Electrical Engineer
NSZZ Solidarność Commission for National Understanding,50,1981-02-01,1981-12-31,IA00806,NSZZS,KKP,Opposition Group Leadership Body National,NA,NA,Władysław Frasyniuk,34,M,Opposition,Worker Bus Mechanic
PZPR member,53,1950-01-01,1968-08-30,IA01113,PZPR,MEM,NA,NA,NA,Bronisław Geremek,56,M,Opposition,Academic Historian
Center for Research and Analysis,54,1982-03-01,1982-08-31,IA00294,CRA,NA,Research Institue,NA,NA,Grażyna Gęsicka,37,F,Opposition,Academic Sociologist
PZPR member,55,1964-01-01,1981-12-31,IA01113,PZPR,MEM,NA,NA,NA,Mieczysław Gil,45,M,Opposition,Worker Steel
Cultural Committee for the Mazowsze Region,56,1980-09-01,1981-12-31,IA00361,CCMR,NA,Independent Society,NA,NA,Maria Gintowt-Jankowicz,45,F,Opposition,Lawyer
NSZZ Solidarność Member,57,1980-09-01,1989-02-01,IA00873,NSZZS,MEMB,Opposition Group,NA,NA,Andrzej Glapiński,44,M,Opposition,Worker Miner
“Suma”,58,1988-01-01,1989-02-01,IA00146,SUMA,NA,Periodical,NA,NA,Elżbieta Golik,24,F,Opposition,Academic Student
Bureau of Construction Projects Gdańsk Shipyards,59,1969-01-01,1970-12-31,IA00270,BCPG,NA,Government Agency Regional or Local,Gdańsk,NA,Bogusław Kazimierz Gołąb,42,M,Opposition,Worker Mechanic
NSZZ Solidarność Founding Committee Institute of Labor and Social Policy,60,1980-09-01,1981-12-31,IA00829,NSZZS,FCILSP,Opposition Group Leadership Body Regional or Local,NA,NA,Helena Góralska,41,F,Opposition,Academic Economist
Inter-factory Strike Committee Katowice Steel Works,61,1980-08-01,1981-12-31,IA00557,MKSK,NA,Protest Action,NA,NA,Jan Andrzej Górny,33,M,Opposition,Worker Computer Systems
Coordinating Committee for Health Services Małopolska,63,1988-01-01,1989-02-01,IA00344,CCHSM,NA,Government Agency Regional or Local,NA,NA,Anna Grajcarek,32,F,Opposition,Medical Doctor
Miners Committee Solidarność Copper Mining and Smelting Plant Lubin,64,1988-01-01,1989-02-01,IA00739,MCSCM,NA,Protest Action,NA,NA,Władysław Grocki,34,M,Opposition,Worker Mining Technician
Association of Polish Architects,65,1970-01-01,1989-02-01,IA00240,SARP,NA,National Professional Association,NA,NA,Andrzej Grudziński,64,M,Opposition,Academic Architect
PAN Laboratory for Social Sciences,66,1966-01-01,1970-12-31,IA01017,PAN,LSS,Research Institue,NA,NA,Janusz Grzelak,47,M,Opposition,Academic Psychologist
Medical Academy Poznań,67,1978-01-01,1989-02-01,IA00727,MEDAP,NA,Postsecondary School,NA,NA,Anna Grzymisławska,41,F,Opposition,Lawyer
Higher School of Pedagogy Gdańsk,68,1960-09-01,1969-08-31,IA00506,HSPG,NA,Postsecondary School,Gdańsk,NA,Jerzy Grzywacz,60,M,Opposition,Academic Physics
KIK Warsaw,69,1972-01-01,1989-02-01,IA00624,KIK,WAW,Salon,NA,NA,Krzysztof Hagemejer,37,M,Opposition,Academic Economics
Mainstream Independence,70,1977-01-01,1977-12-31,IA00696,MAINI,NA,Independent Society,NA,NA,Aleksander Hall,35,M,Opposition,Academic historian
Ministry of Labor Center for Staff Training and Improvement,71,1970-01-01,1983-12-31,IA00760,MINLAB,CSTI,Government Leadership Body National,NA,NA,Arwid Yrio Hansen,71,M,Opposition,Medical Doctor
NSZZ Solidarność Member,72,1980-09-01,1989-02-01,IA00873,NSZZS,MEMB,Opposition Group,NA,NA,Stefania Hejmanowska,51,F,Opposition,Worker Chemist
“Wiedza i Życie”,73,1974-01-01,1989-02-01,IA00159,WIZ,NA,Periodical,NA,NA,Maciej Tadeusz Iłowiecki,53,M,Opposition,Journalist
“Biuletyn Informacyjny” KSS-KOR,75,1977-09-01,1980-02-29,IA00011,BKSS,NA,Periodical,NA,NA,Janina Jankowska,49,F,Opposition,Journalist
Union of Polish Teachers - ZNP,77,1970-01-01,1974-12-31,IA01265,ZNP,NA,NA,NA,NA,Gabriel Janowski,41,M,Opposition,Academic Agriculture
Union of Polish Students - ZSP,80,1966-01-01,1970-12-31,IA01264,ZSP,NA,NA,NA,NA,Jerzy Jaśkowski,40,M,Opposition,Medical Doctor
Polish Radio,81,1973-01-01,1981-12-31,IA01066,RADP,NA,Government Agency National,NA,NA,Wiesław Johann,49,M,Opposition,Lawyer
Łódź University Department of Theory for Strengthening the Economy,82,1975-01-01,1989-02-01,IA00686,LU,DTSE,Postsecondary School,NA,NA,Cezary Józefiak,56,M,Opposition,Academic Economics
Bureau for the Project of Building Nowa Huta,83,1950-01-01,1959-12-31,IA00269,BPBNH,NA,Government Agency Regional or Local,Nowa Huta,NA,Stanisław Juchnowicz,65,M,Opposition,Academic Architect
Lenin Steelworks Nowa Huta,84,1973-01-01,1989-02-01,IA00654,LSWNH,NA,Factory,NA,NA,Stefan Jurczak,50,M,Opposition,Worker Steel Mechanic
Horse Rallies in Memory of the Heroes of September 1939,85,1963-01-01,1981-12-31,IA00514,HRMHS,NA,Independent Society,NA,NA,Mieczysław Kaczanowski,54,M,Opposition,Journalist
Seminar of Stanisław Ehrlich,86,1970-01-01,1980-12-31,IA01165,SEMSE,NA,Salon,NA,NA,Jarosław Kaczyński,39,M,Opposition,Lawyer
KSS-KOR Collaborator,87,1977-09-01,1981-09-30,IA00626,KSSKOR,NA,Opposition Group,NA,NA,Lech Kaczyński,39,M,Opposition,Lawyer
NZS University Committee Warsaw Academy of Medicine,88,1988-10-01,1989-02-01,IA00960,NZS,UCWAM,Opposition Group Leadership Body Regional or Local,NA,NA,Witold Paweł Kalbarczyk,22,M,Opposition,Student
Copernicus University Faculty of Law,89,1962-09-01,1989-02-01,IA00349,KU,FLAW,Postsecondary School,NA,NA,Marian Kallas,50,M,Opposition,Academic Historian
“Nasze Wiadomości”,90,1984-11-01,1989-02-01,IA00086,NWIA,NA,Periodical,NA,NA,Mariusz Kamiński,23,M,Opposition,Student
Miners Trade Union,91,1972-01-01,1980-12-31,IA00742,MNRTU,NA,Opposition Group,NA,NA,Henryk Karaś,40,M,Opposition,Worker Mining Engineer
Polish Ecological Club,93,1980-01-01,1989-02-01,IA01049,PEC,NA,National Professional Association,NA,NA,Andrzej Kassenberg,40,M,Opposition,Academic Geographer
Warsaw Polytechnic Faculty of Environmental Engineering,94,1951-09-01,1956-08-31,IA01307,WPOLY,FENV,Postsecondary School,NA,NA,Janusz Kindler,54,M,Opposition,Academic Engineer
Academic Pastoral Care,95,1983-01-01,1989-02-01,IA00182,APC,NA,Charitable or Humanitarian Organization,NA,NA,Andrzej Klasik,45,M,Opposition,Academic Economics
State Scientific Publishing House,98,1966-01-01,1968-12-31,IA01212,SSPH,NA,Publishing House,NA,NA,Jan Kofman,47,M,Opposition,Academic Historian
NSZZ Solidarność Member,99,1980-09-01,1989-02-01,IA00873,NSZZS,MEMB,Opposition Group,NA,NA,Ryszard Kostrzewa,42,M,Opposition,Worker
Warsaw Office of Building and Investment,100,1964-01-01,1966-12-31,IA01286,WOBI,NA,Government Agency Regional or Local,NA,NA,Adam Tadeusz Kowalewski,48,M,Opposition,Academic Economist
NSZZ Solidarność Workers Committee Lenin Steel Works,101,1980-09-01,1981-12-31,IA00812,NSZZS,WCLSW,Opposition Group Leadership Body Regional or Local,NA,NA,Krzysztof Kozłowski,57,M,Opposition,Journalist
PAN Committee of Environmental Engineers,102,1982-01-01,1987-12-31,IA00988,PAN,COEE,Research Institue,NA,NA,Stefan Kozłowski,61,M,Opposition,Academic Geology
Gdańsk Regional Appeal Commission re Work,103,1978-01-01,1978-12-31,IA00474,GRAC,NA,Government Agency Regional or Local,Gdańsk,NA,Marek Krankowski,42,M,Opposition,Worker Administration
Declaration of the Student Movement,104,1968-03-15,1968-03-15,IA00369,DSM,NA,Protest Statement,NA,NA,Marcin Król,44,M,Opposition,Journalist
KWK “Thirtieth Anniversary of the PRL” Pniówek,105,1973-01-01,1989-02-01,IA00640,KWK13,NA,Factory,NA,NA,Wiktor Krywulko,37,M,Opposition,Worker Mining Technician
Olsztyn Provincial Hospital,106,1966-09-01,1968-08-31,IA00966,OPH,NA,Medical Facility,NA,NA,Marek Kulerski,50,M,Opposition,Medical Doctor
Międzylesie Primary School,107,1960-09-01,1981-12-31,IA00738,MPS,NA,High School,NA,NA,Wiktor Kulerski,44,M,Opposition,Academic Historian
“Red Number One” Warsaw Scout Troop,109,1960-01-01,1976-12-31,IA01126,RED1WST,NA,Scouting Organization,NA,NA,Michał Kulesza,40,M,Opposition,Lawyer
Warsaw University Institute of Microbiology,110,1961-09-01,1986-08-31,IA01352,UW,IMICROB,Postsecondary School,NA,NA,Władysław J.H. Kunicki-Goldfinger,72,M,Opposition,Academic Microbiologist
PAN Committee for Chemistry,111,1976-01-01,1989-02-01,IA00983,PAN,CFC,Research Institue,NA,NA,Gotfryd Kupryszewski,59,M,Opposition,Academic Chemistry
Institute of Hematology Clinic of Internal Medicine,112,1956-01-01,1960-12-31,IA00530,IHCIM,NA,Research Institue,NA,NA,Zofia Kuratowska,57,F,Opposition,Medical Doctor
“Hot”,113,1957-01-01,1960-12-31,IA00056,HOT,NA,Periodical,NA,NA,Jacek Kurczewski,46,M,Opposition,Academic Sociologist
“Red Troop” Polish Scouting Association,114,1955-01-01,1964-12-31,IA01125,REDTPSA,NA,Scouting Organization,NA,NA,Jacek Kuroń,54,M,Opposition,Academic Historian
